Project/township/building,Tenure,Type,Median price,Median PSF,Transactions,Unnamed:6
"BANDAR SEGAMAT BARUSegamat, Johor",Freehold,Terrace House,"RM160,000",RM138,11,
"TAMAN TUN SAMBANTHANSungai Siput, Perak",Leasehold,Terrace House,"RM175,000",RM115,11,
"TAMAN KLEDANG MASIpoh, Perak",Leasehold,Terrace House,"RM285,000",RM243,11,
"TAMAN CHERAS AWANACheras, Selangor",Freehold,Terrace House,"RM480,000",RM418,11,
"TAMAN JATIRawang, Selangor",Leasehold,Terrace House,"RM300,000",RM201,11,
"TAMAN PERUNASungai Udang, Melaka",Leasehold,Terrace House,"RM180,000",RM113,11,
"BANDAR DAMANSARA KUANTANSungai Karang, Pahang",Freehold,Terrace House,"RM300,000",RM166,11,
"TAMAN SKUDAI INDAHSkudai, Johor",Freehold,"Semi D, Cluster House, Terrace House","RM600,000",RM375,11,
"BANDAR BARU WANGSA MAJUWangsa Maju, Kuala Lumpur",Leasehold,Terrace House,"RM785,000",RM477,11,
"TAMAN BAGAN KURNIAJimah, Negeri Sembilan",Freehold,Terrace House,"RM220,000",RM143,11,
"TAMAN BENDAHARAKuala Selangor, Selangor",Freehold,Terrace House,"RM240,000",RM227,11,
"TAMAN KOSASAmpang, Selangor",Leasehold,Terrace House,"RM560,000",RM322,11,
"TAMAN PERAI UTAMAPerai, Penang",Freehold,"Town House, Terrace House","RM380,000",RM284,11,
"BANDAR CEMERLANGTebrau, Johor",Freehold,"Semi D, Terrace House","RM680,000",RM387,11,
"TAMAN PINGGIRAN PEDASPedas, Negeri Sembilan",Freehold,Terrace House,"RM175,000",RM115,11,
"BANDAR PINGGIRAN SUBANGSungai Buloh, Selangor",Leasehold,Terrace House,"RM590,000",RM475,11,
"JALAN AIR ITAMAyer Itam, Penang",Freehold,"Terrace House, Semi D, Bungalow","RM1,200,000",RM391,11,
"TAMAN VISTA VERDEKuantan, Pahang",Freehold,Terrace House,"RM420,000",RM238,11,
"TAMAN PENGKALAN 18Ipoh, Perak",Leasehold,Terrace House,"RM410,000",RM251,11,
"NADA 5 @ NADA ALAMMantin, Negeri Sembilan",Freehold,Terrace House,"RM605,000",RM432,11,
"TAMAN BANANG HEIGHTSBatu Pahat, Johor",Freehold,"Terrace House, Semi D","RM400,000",RM195,11,
"HOUSING TRUSTIpoh, Perak",Leasehold,"Bungalow, Semi D","RM310,000",RM78,11,
"TAMAN KELAB TUANKURantau, Negeri Sembilan",Freehold,Terrace House,"RM195,000",RM163,11,
"TAMAN SRI LALANGKota Tinggi, Johor",Freehold,Terrace House,"RM315,000",RM141,11,
"TAMAN KIJANGLunas, Kedah",Freehold,"Cluster House, Semi D","RM300,000",RM156,11,
"TAMAN MURNIKluang, Johor",Freehold,Terrace House,"RM180,000",RM169,11,
"BANDAR SERI EHSANTanjong Duabelas, Selangor",Leasehold,Terrace House,"RM280,000",RM214,11,
"TAMAN SUTERAKajang, Selangor",Freehold,Terrace House,"RM590,000",RM407,11,
"KINGFISHER PARK PH2Kota Kinabalu, Sabah",Leasehold,Terrace House,"RM660,000",RM319,11,
"TAMAN DESA KENCANAKapar, Selangor",Freehold,Terrace House,"RM390,000",RM190,11,
"PINGGIRAN USJSubang Jaya, Selangor",Freehold,Terrace House,"RM650,000",RM441,11,
"TAMAN JAMBUBukit Mertajam, Penang",Freehold,"Terrace House, Semi D","RM235,000",RM200,11,
"SENIBONG COVEPermas Jaya, Johor",Freehold,"Cluster House, Terrace House","RM1,150,000",RM473,11,
"Anggerik CourtSandakan, Sabah",Leasehold,Apartment,"RM225,000",RM231,11,
"Taman Haji Mohd AminPermatang Pauh, Penang",Freehold,Flat,"RM145,000",RM203,11,
"Rumah Pangsa Taman BidaraSeremban, Negeri Sembilan",Freehold,Flat,"RM80,000",RM130,11,
"Taman Tampoi UtamaTampoi, Johor",Leasehold,Flat,"RM140,000",RM213,11,
"Anggerik Villa 2Kajang, Selangor",Freehold,Apartment,"RM250,000",RM216,11,
"Apartment KekwaSerendah, Selangor",Freehold,Apartment,"RM109,000",RM141,11,
"D'Putra SuitesSenai, Johor",Freehold,Service Residence,"RM438,900",RM543,11,
"Impian Senibong ApartmentPermas Jaya, Johor",Leasehold,Apartment,"RM380,000",RM327,11,
"Ixora ApartmentsBukit Bintang, Kuala Lumpur",Leasehold,Apartment,"RM300,000",RM306,11,
"AirtrollisLabu, Negeri Sembilan",Freehold,Apartment,"RM190,000",RM204,11,
"Desa Pantai FlatPantai, Kuala Lumpur",Leasehold,Flat,"RM220,000",RM358,11,
"Platinum Lake PV 12Setapak, Kuala Lumpur",Leasehold,Condominium,"RM460,000",RM381,11,
"Alam DamaiKota Kinabalu, Sabah",Leasehold,Condominium,"RM630,000",RM561,11,
"Gravit8Port Klang, Selangor",Freehold,Service Residence,"RM671,000",RM604,11,
"Taman Teluk KumbarTeluk Kumbar, Penang",Freehold,Flat,"RM155,000",RM335,11,
"Jalan Haji Manan FlatKluang, Johor",Leasehold,Flat,"RM92,000",RM118,11,
"Rista Villa ApartmentPuchong, Selangor",Leasehold,Apartment,"RM130,000",RM215,11,
"Sejati UjanaSandakan, Sabah",Leasehold,Apartment,"RM190,000",RM267,11,
"Seri SemarakRawang, Selangor",Freehold,Flat,"RM27,500",RM42,11,
"Platinum Lake PV 20Setapak, Kuala Lumpur",Leasehold,Condominium,"RM465,000",RM342,11,
"Pangsapuri Subang SuriaSungai Buloh, Selangor",Leasehold,Apartment,"RM262,000",RM338,11,
"The Leafz @ DedaunSalak Selatan, Kuala Lumpur",Freehold,Service Residence,"RM550,000",RM556,11,
"Vipod ResidenceKLCC, Kuala Lumpur",Freehold,Service Residence,"RM1,300,000","RM1,164",11,
"Unipark CondominiumBangi, Selangor",Freehold,Condominium,"RM340,000",RM280,11,
"Sri PanglimaJohor Bahru, Johor",Leasehold,Apartment,"RM170,000",RM173,11,
"Taman LTATBukit Jalil, Kuala Lumpur",Leasehold,Apartment,"RM200,000",RM304,11,
"Taman Nelly Phase 8DKota Kinabalu, Sabah",Leasehold,Apartment,"RM150,000",RM584,11,
"Zefer Hill ResidencePuchong, Selangor",Freehold,Condominium,"RM600,000",RM392,11,
"Amaya MaluriCheras, Kuala Lumpur",Leasehold,Service Residence,"RM499,000",RM639,11,
"Pangsapuri Seri PinangSeri Kembangan, Selangor",Freehold,Apartment,"RM340,000",RM367,11,
"Park View TowerButterworth, Penang",Freehold,Condominium,"RM350,000",RM396,11,
"Grace VilleKota Kinabalu, Sabah",Leasehold,Condominium,"RM600,000",RM431,11,
"The Lumayan ApartmentCheras, Kuala Lumpur",Leasehold,Apartment,"RM340,000",RM410,11,
"Sky Suites @ KLCCKLCC, Kuala Lumpur",Freehold,Service Residence,"RM1,000,000","RM1,242",11,
"University Condo Apartment 1 (UCA 1)Kota Kinabalu, Sabah",Leasehold,Apartment,"RM225,000",RM364,11,
"A'Marine CondominiumBandar Sunway, Selangor",Leasehold,Condominium,"RM900,000",RM576,11,
"ImpianaIskandar Puteri (Nusajaya), Johor",Freehold,Apartment,"RM440,000",RM357,11,
"Suria ResidenceCheras, Selangor",Freehold,Apartment,"RM350,000",RM283,11,
"Pangsapuri Seri PerantauPort Klang, Selangor",Leasehold,Flat,"RM120,000",RM185,11,
"Taman Sri KuchingJalan Kuching, Kuala Lumpur",Freehold,Flat,"RM200,000",RM269,11,
"Mewah CourtJelutong, Penang",Leasehold,Apartment,"RM297,000",RM336,11,
"Bandar Baru KundangRawang, Selangor",Leasehold,Flat,"RM135,000",RM171,11,
"Danga View ApartmentTampoi, Johor",Freehold,Apartment,"RM380,000",RM296,11,
"Evergreen Park Acorn & HazelBandar Sungai Long, Selangor",Freehold,Condominium,"RM327,000",RM289,11,
"Bayswater Resort CondominiumGelugor, Penang",Freehold,Condominium,"RM820,000",RM658,11,
"Platinum Lake PV 15Setapak, Kuala Lumpur",Leasehold,Condominium,"RM500,000",RM363,11,
"Flat Danau KotaSetapak, Kuala Lumpur",Leasehold,Flat,"RM170,000",RM243,11,
"Putra MajestikJalan Ipoh, Kuala Lumpur",Freehold,Service Residence,"RM499,000",RM488,11,
"Casa Villa CondominiumKajang, Selangor",Freehold,Condominium,"RM290,000",RM245,11,
"Seri BaiduriSetia Alam, Selangor",Freehold,Apartment,"RM380,000",RM410,11,
"Grand MediniIskandar Puteri (Nusajaya), Johor",Freehold,Condominium,"RM399,000",RM842,11,
"Sentul Utama FlatSentul, Kuala Lumpur",Leasehold,Flat,"RM173,000",RM279,11,
"MelorKajang, Selangor",Freehold,Apartment,"RM42,000",RM62,11,
"Flat Bukit IndahIskandar Puteri (Nusajaya), Johor",Freehold,Flat,"RM190,000",RM254,11,
"Taman BenderaSungai Ara, Penang",Freehold,Flat,"RM189,000",RM351,11,
"Eden Seaview CondominiumBatu Ferringhi, Penang",Freehold,Condominium,"RM300,000",RM322,11,
"Widuri ApartmentButterworth, Penang",Freehold,Apartment,"RM205,000",RM266,11,
"Pertiwi IndahCheras, Kuala Lumpur",Leasehold,Condominium,"RM490,000",RM390,11,
"Taman Sri SentosaKlang, Selangor",Freehold,Flat,"RM98,000",RM142,11,
"Pandan Heights CondominiumAmpang, Selangor",Freehold,Condominium,"RM290,000",RM337,11,
"Fortune AvenueKepong, Kuala Lumpur",Leasehold,Service Residence,"RM425,000",RM356,11,
"U Garden Resort CondominiumGelugor, Penang",Freehold,Condominium,"RM357,000",RM510,11,
"Kiara Designer SuitesMont Kiara, Kuala Lumpur",Freehold,Service Residence,"RM668,000",RM556,11,
"Dahlia ApartmentsRawang, Selangor",Freehold,Flat,"RM55,000",RM92,11,
"Tuaran ImpianTuaran, Sabah",Leasehold,Apartment,"RM190,000",RM247,11,
"TerataiSerendah, Selangor",Leasehold,Flat,"RM70,000",RM108,11,
"Plaza Indah ApartmentKajang, Selangor",Freehold,Apartment,"RM215,000",RM235,11,
"Idaman PuteraSetapak, Kuala Lumpur",Freehold,Condominium,"RM380,000",RM285,11,
"Serendah Golf ResortSerendah, Selangor",Leasehold,Apartment,"RM68,000",RM77,11,
"Pandora @ Tropicana MetroparkSubang Jaya, Selangor",Freehold,Service Residence,"RM365,000",RM605,11,
"Taman Sri RelauBukit Jambul, Penang",Freehold,Flat,"RM240,000",RM348,11,
"Rumah Pangsa Sri OrkidUlu Tiram, Johor",Freehold,Flat,"RM145,000",RM204,11,
"Serin ResidencyCyberjaya, Selangor",Freehold,Condominium,"RM400,000",RM341,11,
"Apartment DahliaSerendah, Selangor",Freehold,Flat,"RM80,000",RM108,11,
"RPR LANDEH/TAMAN SRI PERMAIKuching, Sarawak",Freehold,Terrace House,"RM165,000",RM109,10,
"TAMAN SRI TREH (TAMAN BINTANG ANGKASA)Muar, Johor",Freehold,Terrace House,"RM475,000",RM309,10,
"TAMAN GRANDVIEWSandakan, Sabah",Leasehold,Terrace House,"RM437,500",RM194,10,
"TAMAN KELAB UKAYUlu Klang, Selangor",Freehold,Terrace House,"RM690,000",RM348,10,
"PUNCAK PERDANAShah Alam, Selangor",Leasehold,Town House,"RM355,000",RM364,10,
"TAMAN MAHSURI 2AJitra, Kedah",Freehold,Terrace House,"RM197,500",RM157,10,
"TAMAN KINDING FLORAIpoh, Perak",Leasehold,"Cluster House, Terrace House","RM260,000",RM186,10,
"PJS 9Bandar Sunway, Selangor",Leasehold,Terrace House,"RM949,000",RM541,10,
"TAMAN NUSARI BAYU 2Bandar Sri Sendayan, Negeri Sembilan",Freehold,Terrace House,"RM297,500",RM204,10,
"P/L 2366, 2367, 3694, 3752 & 4169Kuantan, Pahang",Freehold,Terrace House,"RM438,880",RM298,10,
"TAMAN RIA 2, SUNGAI BESARSungai Besar, Selangor",Leasehold,"Terrace House, Semi D","RM802,000",RM318,10,
"TAMAN MESRA, OFF JALAN SUNGAI JATIKlang, Selangor",Freehold,"Semi D, Terrace House","RM495,000",RM290,10,
"TAMAN NURI EMASNibong Tebal, Penang",Freehold,Semi D,"RM800,000",RM306,10,
"TAMAN MASJID TANAH PERDANAMasjid Tanah, Melaka",Freehold,Semi D,"RM410,000",RM128,10,
"GARDEN CITY HOMES @ SEREMBAN 2Seremban 2, Negeri Sembilan",Freehold,Terrace House,"RM571,000",RM294,10,
"RAINTREE PARK2Sungai Bakap, Penang",Freehold,"Terrace House, Town House","RM607,500",RM302,10,
"SEREMBAN FOREST HEIGHTSAmpangan, Negeri Sembilan",Freehold,Terrace House,"RM820,000",RM422,10,
"MUTIARA HILLS @ SEMENYIHSemenyih, Selangor",Freehold,Terrace House,"RM576,000",RM409,10,
"TAMAN KOTA IMPIAN @ IMPIAN HILLSKota Tinggi, Johor",Freehold,Terrace House,"RM520,125",RM308,10,
"TAMAN ALAMANDA (KEDIAMAN)Bahau, Negeri Sembilan",Leasehold,Terrace House,"RM229,150",RM176,10,
"TAMAN MERU SINARIpoh, Perak","Freehold, Leasehold",Terrace House,"RM438,800",RM235,10,
"BAYU SUTERA - PRECINT 2AJimah, Negeri Sembilan",Freehold,Terrace House,"RM529,999",RM379,10,
"TAMAN JURU SETIAJuru, Penang",Freehold,Cluster House,"RM636,500",RM292,10,
"TAMAN CENDANASungai Petani, Kedah",Freehold,"Terrace House, Semi D","RM215,000",RM110,10,
"TAMAN KOK LIANJalan Kuching, Kuala Lumpur",Freehold,Terrace House,"RM550,000",RM467,10,
"R.P.R RANGAULimbang, Sarawak",Freehold,Terrace House,"RM90,000",RM98,10,
"TAMAN YAYASANJenjarom, Selangor","Freehold, Leasehold",Terrace House,"RM465,000",RM259,10,
"KAWASAN ABDUL SAMAD/MARIMAHJohor Bahru, Johor","Leasehold, Freehold","Semi D, Bungalow","RM694,000",RM151,10,
"KAMPUNG RAJA UDAKlang, Selangor","Freehold, Leasehold","Bungalow, Terrace House","RM450,000",RM146,10,
"KAMPUNG TASIK PERMAIAmpang, Selangor",Leasehold,Bungalow,"RM350,000",RM89,10,
"TAMAN MUTIARA GADING (TR 277)Batu Pahat, Johor",Freehold,Terrace House,"RM487,500",RM339,10,
"TAMAN SERI BAYUSabai, Pahang",Freehold,Terrace House,"RM280,000",RM167,10,
"TAMAN LEMBAH MAJUAmpang, Selangor",Leasehold,Town House,"RM357,500",RM489,10,
"TAMAN SRI PERDANALahad Datu, Sabah",Leasehold,"Semi D, Terrace House","RM497,500",RM154,10,
"TAMAN TRIANG MAJUTriang, Pahang",Freehold,Terrace House,"RM117,500",RM107,10,
"TAMAN AYER KEROH PERMAIBukit Baru, Melaka",Freehold,Terrace House,"RM281,500",RM175,10,
"TAMAN MELAKA BARU FASA 3ABatu Berendam, Melaka",Leasehold,Terrace House,"RM230,000",RM192,10,
"TAMAN TUAH PERDANABemban, Melaka",Leasehold,Terrace House,"RM277,500",RM213,10,
"TAMAN ECO MEADOWSimpang Ampat, Penang",Freehold,Terrace House,"RM684,500",RM484,10,
"BANDAR PUTRAKuantan, Pahang",Freehold,Terrace House,"RM290,000",RM214,10,
"TAMAN DESAMuar, Johor",Freehold,"Terrace House, Semi D","RM447,500",RM332,10,
"TAMAN HILLTOPMiri, Sarawak",Leasehold,Semi D,"RM495,000",RM126,10,
"BANDAR PUTERI JAYA SEKSYEN 3ASungai Petani, Kedah",Freehold,"Terrace House, Semi D","RM345,000",RM108,10,
"TAMAN KUALA PERMAI (R.AWAM TANJUNG DAHAN II)Kuala Sungai Baru, Melaka","Leasehold, Freehold",Terrace House,"RM112,500",RM98,10,
"TAMAN LINGGI IDAMANLinggi, Negeri Sembilan",Freehold,Terrace House,"RM314,000",RM164,10,
"TAMAN SCIENTEX KULAI 2Kulai, Johor",Freehold,"Town House, Cluster House, Terrace House","RM465,000",RM245,10,
"TAMAN BUKIT GALENASeremban, Negeri Sembilan",Freehold,Terrace House,"RM435,000",RM266,10,
"PRIMA 1 MALAYSIA BANDAR GAMBANGKuantan, Pahang",Leasehold,Semi D,"RM200,000",RM71,10,
"TAMAN DAHLIASepang, Selangor",Freehold,"Semi D, Terrace House","RM455,000",RM193,10,
"TAMAN TEMIANG JAYASikamat, Negeri Sembilan",Freehold,Terrace House,"RM250,000",RM142,10,
"GELIGA BESARKemaman, Terengganu",Freehold,Semi D,"RM362,500",RM108,10,
"SEKSYEN 4Petaling Jaya, Selangor",Leasehold,"Bungalow, Terrace House","RM985,000",RM308,10,
"TAMAN BUKIT BERUANG UTAMABukit Baru, Melaka",Freehold,Terrace House,"RM294,000",RM226,10,
"TAMAN SEPUTEHSeputeh, Kuala Lumpur",Freehold,Terrace House,"RM1,525,000",RM652,10,
"TAMAN KAJANG MEWAHKajang, Selangor",Freehold,"Semi D, Terrace House","RM482,500",RM275,10,
"SETIA IMPIAN 7Setia Alam, Selangor",Freehold,"Semi D, Cluster House","RM732,500",RM445,10,
"TAMAN RIMBA (PEC LOT 1135)Mentakab, Pahang",Freehold,Terrace House,"RM165,000",RM200,10,
"TAMAN BUNGA RAYAKuala Kangsar, Perak",Leasehold,Terrace House,"RM189,500",RM144,10,
"TAMAN MUHIBBAHKlebang, Melaka",Freehold,Semi D,"RM464,900",RM140,10,
"TAMAN LIMAU MANISAlor Setar, Kedah",Freehold,Terrace House,"RM271,000",RM200,10,
"SIERRAMAS WESTSungai Buloh, Selangor",Freehold,Bungalow,"RM2,475,000",RM617,10,
"TAMAN MERDEKA FASA 1DBatu Berendam, Melaka",Leasehold,Terrace House,"RM283,000",RM175,10,
"TAMAN MERGONG JAYA (FASA 1)Alor Setar, Kedah",Freehold,Terrace House,"RM220,000",RM183,10,
"TAMAN INTAN FASA 3Sungai Petani, Kedah",Freehold,"Terrace House, Semi D","RM325,000",RM119,10,
"TAMAN MURNIBatu Pahat, Johor",Freehold,Terrace House,"RM285,000",RM227,10,
"TAMAN SILIBIN RIAIpoh, Perak",Leasehold,Terrace House,"RM447,500",RM304,10,
"TAMAN MUTIARA BESTARISkudai, Johor",Freehold,Cluster House,"RM1,105,460",RM391,10,
"SIERRAMASSungai Buloh, Selangor",Freehold,"Terrace House, Bungalow","RM3,100,000",RM588,10,
"TAMAN SARIBanting, Selangor",Freehold,Terrace House,"RM365,000",RM207,10,
"BUKIT BANDARAYA SHAH ALAMShah Alam, Selangor",Leasehold,"Semi D, Bungalow","RM915,000",RM371,10,
"KAMPUNG BARU KOPISANGopeng, Perak",Leasehold,Bungalow,"RM79,000",RM20,10,
"TAMAN SRI PULASANSeremban, Negeri Sembilan",Leasehold,Terrace House,"RM205,000",RM167,10,
"TAMAN LUMBA KUDAAlor Setar, Kedah",Freehold,Semi D,"RM585,000",RM171,10,
"TAMAN SERI IMPIANBukit Mertajam, Penang",Freehold,Terrace House,"RM562,500",RM441,10,
"TAMAN CEMPAKASenawang, Negeri Sembilan",Leasehold,Terrace House,"RM250,000",RM202,10,
"TAMAN KUCAIKulim, Kedah",Freehold,"Semi D, Terrace House","RM260,000",RM152,10,
"TAMAN TIRAMKulim, Kedah",Freehold,Terrace House,"RM250,000",RM168,10,
"TAMAN ANDAIpoh, Perak",Leasehold,Terrace House,"RM275,000",RM167,10,
"DESA SRI JENARISKajang, Selangor",Freehold,Terrace House,"RM347,500",RM317,10,
"TAMAN PEDAS INDAHPedas, Negeri Sembilan",Freehold,Terrace House,"RM197,500",RM159,10,
"TAMAN BERSATURawang, Selangor",Leasehold,Terrace House,"RM300,000",RM193,10,
"TAMAN KOTA PERDANASeri Kembangan, Selangor",Leasehold,"Terrace House, Semi D","RM535,000",RM278,10,
"PRIMA SP BAIDURI (SP 1)Sungai Petani, Kedah",Freehold,Terrace House,"RM220,000",RM154,10,
"KUNDANG JAYARawang, Selangor",Freehold,Terrace House,"RM515,000",RM200,10,
"TAMAN KOPERASI MUHIBBAHKluang, Johor",Freehold,Terrace House,"RM294,000",RM169,10,
"TAMAN SERI MURNIButterworth, Penang",Freehold,Terrace House,"RM555,000",RM382,10,
"SENIBONG VILLASMasai, Johor",Freehold,Semi D,"RM1,850,000",RM489,10,
"TAMAN KAMPAR PERDANAKampar, Perak",Leasehold,Terrace House,"RM245,000",RM167,10,
"TAMAN MEWAH KULAIKulai, Johor",Freehold,"Terrace House, Semi D","RM280,000",RM197,10,
"TAMAN PUNCAK SAUJANAKajang, Selangor",Freehold,"Semi D, Terrace House, Town House","RM595,000",RM381,10,
"JALAN INDAHSibu, Sarawak",Leasehold,Terrace House,"RM252,500",RM148,10,
"TAMAN PUTERIKuching, Sarawak",Leasehold,"Terrace House, Semi D","RM407,500",RM150,10,
"TAMAN BADRISHAHLahat, Perak",Leasehold,Terrace House,"RM195,000",RM118,10,
"TAMAN PUNCAK BERTAM (MALIM HILL PARK)Bertam, Melaka",Freehold,Terrace House,"RM574,400",RM311,10,
"TAMAN DESAKluang, Johor",Freehold,Terrace House,"RM247,500",RM166,10,
"DESA WIRAKuching, Sarawak","Leasehold, Freehold",Terrace House,"RM345,000",RM188,10,
"TAMAN KASIH PUTERABahau, Negeri Sembilan",Freehold,Terrace House,"RM287,500",RM187,10,
"TAMAN AIR KEROH FASA 1-3Bukit Katil, Melaka",Leasehold,Terrace House,"RM240,000",RM134,10,
"NUSAVILLAIskandar Puteri (Nusajaya), Johor",Freehold,Town House,"RM475,000",RM284,10,
"RIVERIAKota Samarahan, Sarawak",Leasehold,"Terrace House, Semi D","RM670,000",RM195,10,
"TAMAN SALENGKulai, Johor",Freehold,Terrace House,"RM117,000",RM155,10,
"TAMAN TERUSBintulu, Sarawak",Leasehold,"Semi D, Terrace House","RM474,000",RM251,10,
"TAMAN PANTAI LOK KAWIPapar, Sabah",Leasehold,"Terrace House, Bungalow","RM425,000",RM177,10,
"TAMAN PENAGA PERMAIPenaga, Penang",Freehold,"Town House, Terrace House","RM170,000",RM265,10,
"TAMAN BALAI PANJANG MURNIBalai Panjang, Melaka",Freehold,Terrace House,"RM313,240",RM161,10,
"TAMAN RIA HEIGHTTawau, Sabah",Leasehold,Terrace House,"RM411,785",RM239,10,
"PERUMAHAN ATABARA PERDANAKuantan, Pahang",Leasehold,Terrace House,"RM230,000",RM258,10,
"TAMAN KEMPAS FASA 1Sungai Petani, Kedah",Freehold,Terrace House,"RM162,500",RM129,10,
"SUNRISE AVENUEIpoh, Perak",Leasehold,Terrace House,"RM312,500",RM197,10,
"KAMPUNG BARU PASIR PINJIIpoh, Perak",Leasehold,Bungalow,"RM142,750",RM36,10,
"TAMAN LIM, IPOHIpoh, Perak",Freehold,"Semi D, Terrace House","RM341,061",RM105,10,
"TAMAN KAJANG PERDANAKajang, Selangor","Freehold, Leasehold",Terrace House,"RM527,500",RM332,10,
"TAMAN MEGAHBatu Pahat, Johor",Freehold,Terrace House,"RM254,000",RM186,10,
"TAMAN PERPADUAN MULIA (SERI GARDEN)Tambun, Perak",Leasehold,Terrace House,"RM495,000",RM310,10,
"TAMAN PUTERA INDAHMuar, Johor",Freehold,Terrace House,"RM734,000",RM353,10,
"TAMAN BANANG JAYABatu Pahat, Johor",Freehold,Terrace House,"RM259,400",RM213,10,
"TAMAN KEMPASTampoi, Johor",Freehold,Terrace House,"RM362,500",RM330,10,
"TAMAN DESA IDAMANDurian Tunggal, Melaka",Freehold,"Semi D, Terrace House","RM400,000",RM170,10,
"MAHKOTA PERMAIKuantan, Pahang",Leasehold,Terrace House,"RM270,000",RM189,10,
"TAMAN BAYU MUTIARABukit Mertajam, Penang",Freehold,Terrace House,"RM650,000",RM418,10,
"TAMAN BAHAGIA DELIMAKuala Pilah, Negeri Sembilan",Freehold,"Semi D, Terrace House","RM200,000",RM125,10,
"PETALING GARDENKepong, Kuala Lumpur",Freehold,Terrace House,"RM722,500",RM422,10,
"TAMAN MELAWATISkudai, Johor",Freehold,Terrace House,"RM475,000",RM291,10,
"TAMAN KEMUNINGKulim, Kedah",Freehold,Terrace House,"RM332,500",RM204,10,
"PERDANA COLLEGE HEIGHTSMantin, Negeri Sembilan",Freehold,Terrace House,"RM445,000",RM326,10,
"TAMAN BUKIT DAHLIAMasai, Johor",Leasehold,Terrace House,"RM490,000",RM320,10,
"TAMAN SRI IMPIAN FASA 1Alor Setar, Kedah",Freehold,Terrace House,"RM275,000",RM178,10,
"TAMAN PONTIAN PERDANAPontian, Johor",Freehold,Bungalow,"RM691,950",RM137,10,
"PINGGIRAN BERTAM PERDANA (BP4)Kepala Batas, Penang",Freehold,Terrace House,"RM270,000",RM229,10,
"Flat DaisyMasai, Johor",Leasehold,Flat,"RM145,000",RM193,10,
"Ruby Tower (Ria)Butterworth, Penang",Freehold,Apartment,"RM240,000",RM305,10,
"Magna VilleSelayang, Selangor",Leasehold,Condominium,"RM329,815",RM326,10,
"Taman Desa BelantikJohor Bahru, Johor",Leasehold,Apartment,"RM195,000",RM259,10,
"Perai JayaPerai, Penang",Leasehold,Flat,"RM46,500",RM79,10,
"USJ One Avenue CondoSubang Jaya, Selangor",Leasehold,Condominium,"RM535,000",RM361,10,
"Flat PKNS Seksyen 8Shah Alam, Selangor",Leasehold,Flat,"RM177,000",RM299,10,
"Mahkota ResidenceCheras, Selangor",Freehold,Apartment,"RM375,000",RM320,10,
"Sphere DamansaraDamansara Damai, Selangor",Leasehold,Service Residence,"RM480,000",RM421,10,
"Apartment Seri TelukiHulu Selangor, Selangor",Freehold,Flat,"RM122,500",RM155,10,
"De TropicanaKuchai Lama, Kuala Lumpur",Leasehold,Condominium,"RM257,500",RM260,10,
"Cheras RiaCheras, Kuala Lumpur",Freehold,Flat,"RM150,000",RM263,10,
"Mont Kiara AmanMont Kiara, Kuala Lumpur",Freehold,Condominium,"RM1,315,000",RM624,10,
"Saujana Heights ApartmentsTeluk Kumbar, Penang",Freehold,Apartment,"RM220,000",RM394,10,
"Juta MinesSeri Kembangan, Selangor",Leasehold,Condominium,"RM330,000",RM333,10,
"Kinrara CourtBandar Kinrara, Selangor",Leasehold,Flat,"RM230,000",RM262,10,
"Amaya SaujanaSaujana, Selangor",Freehold,Condominium,"RM920,000",RM549,10,
"Kelana MahkotaKelana Jaya, Selangor",Leasehold,Condominium,"RM557,500",RM417,10,
"Azuria CondominiumTanjung Bungah, Penang",Freehold,Condominium,"RM260,000",RM371,10,
"Cocobay ResortPort Dickson, Negeri Sembilan",Freehold,Condominium,"RM115,000",RM147,10,
"SerojaSetia Alam, Selangor",Freehold,Flat,"RM195,000",RM290,10,
"Platinum Lake PV 16Setapak, Kuala Lumpur",Leasehold,Condominium,"RM480,000",RM357,10,
"Glomac DamansaraTaman Tun Dr Ismail, Kuala Lumpur",Freehold,Service Residence,"RM848,500",RM759,10,
"Vista Millennium CondominiumPuchong, Selangor",Leasehold,Condominium,"RM300,000",RM322,10,
"Taman Daya - Jalan Pinang 3, 4Tebrau, Johor",Freehold,Flat,"RM127,500",RM217,10,
"Danau PermaiTaman Desa, Kuala Lumpur",Leasehold,Condominium,"RM490,000",RM453,10,
"Pertama ResidencyCheras, Kuala Lumpur",Leasehold,Service Residence,"RM387,500",RM481,10,
"Subang Perdana Goodyear Court 9Subang Jaya, Selangor",Freehold,Apartment,"RM370,000",RM394,10,
"Taman TerbilangButterworth, Penang",Freehold,Apartment,"RM337,500",RM278,10,
"28 BoulevardAmpang, Selangor",Leasehold,Service Residence,"RM445,000",RM697,10,
"Prima Midah HeightsCheras, Kuala Lumpur",Freehold,Condominium,"RM597,500",RM404,10,
"Puteri Palma CondominiumPutrajaya, Putrajaya",Freehold,Condominium,"RM500,000",RM336,10,
"CloudTree ResidenceCheras, Selangor",Freehold,Condominium,"RM622,900",RM476,10,
"Seksyen 4 Wangsa Maju FlatWangsa Maju, Kuala Lumpur",Leasehold,Flat,"RM200,000",RM380,10,
"Anjali North KiaraSegambut, Kuala Lumpur",Freehold,Condominium,"RM1,140,000",RM637,10,
"Platinum Lake PV 13Setapak, Kuala Lumpur",Leasehold,Condominium,"RM498,500",RM365,10,
"ImpianTanjong Duabelas, Selangor",Leasehold,Apartment,"RM160,000",RM252,10,
"Sky Gardens ResidencesTampoi, Johor",Freehold,Service Residence,"RM445,000",RM387,10,
"Putra RiaBangsar, Kuala Lumpur",Leasehold,Flat,"RM250,000",RM406,10,
"Bayu MarinaJohor Bahru, Johor",Leasehold,Apartment,"RM245,000",RM358,10,
"Valencia ApartmentShah Alam, Selangor",Freehold,Apartment,"RM152,500",RM183,10,
"Bandar Baru Permas JayaPermas Jaya, Johor",Freehold,Flat,"RM170,000",RM232,10,
"Mewah View Luxurious ApartmentsTampoi, Johor",Freehold,Apartment,"RM355,000",RM273,10,
"The CloversBayan Lepas, Penang",Freehold,Condominium,"RM625,000",RM468,10,
"Vista Komanwel ABukit Jalil, Kuala Lumpur",Freehold,Condominium,"RM420,000",RM334,10,
"VIM 3 @ Desa Park NorthKepong, Kuala Lumpur",Leasehold,Service Residence,"RM367,000",RM744,10,
"The VyneSungai Besi, Kuala Lumpur",Leasehold,Condominium,"RM677,000",RM626,10,
"Park AvenueTampoi, Johor",Leasehold,Apartment,"RM174,000",RM240,10,
"Taman Bukit ErskineTanjong Tokong, Penang",Freehold,Apartment,"RM270,000",RM413,10,
"Casa Ria ApartmentRawang, Selangor",Freehold,Apartment,"RM220,000",RM276,10,
"Ramin ApartmentGenting Highlands, Pahang",Freehold,Apartment,"RM310,000",RM486,10,
"Casa IdamanSentul, Kuala Lumpur",Leasehold,Condominium,"RM382,500",RM360,10,
"Residensi Warnasari 2Bandar Puncak Alam, Selangor",Leasehold,Apartment,"RM280,000",RM327,10,
"Anjung Hijau (Greenfields)Bukit Jalil, Kuala Lumpur",Freehold,Apartment,"RM410,000",RM416,10,
"D'Pines@AmpangAmpang, Selangor",Leasehold,Condominium,"RM740,000",RM386,10,
"Idaman LavenderSungai Ara, Penang",Freehold,Apartment,"RM345,000",RM452,10,
"SD Apartments IIBandar Sri Damansara, Selangor",Freehold,Apartment,"RM270,000",RM366,10,
"Midfields 2Sungai Besi, Kuala Lumpur",Leasehold,Condominium,"RM542,500",RM466,10,
"Desa GreenJelutong, Penang",Freehold,Apartment,"RM276,500",RM395,10,
"Pusat Komersial Seksyen 7Shah Alam, Selangor",Leasehold,Flat,"RM277,500",RM348,10,
"Silk ResidenceCheras, Selangor",Freehold,Apartment,"RM370,000",RM364,10,
"Bennington Residences @ SkyArenaSetapak, Kuala Lumpur",Leasehold,Condominium,"RM737,365",RM593,10,
"Desaminium RimbaSeri Kembangan, Selangor",Leasehold,Apartment,"RM280,000",RM250,10,
"Taman Seri Sari (Sunshine Garden)Bukit Jambul, Penang",Freehold,Apartment,"RM248,500",RM355,10,
"Pulai ViewTampoi, Johor",Leasehold,Apartment,"RM402,500",RM322,10,
"The Northshore GardensDesa ParkCity, Kuala Lumpur",Freehold,Condominium,"RM1,605,000",RM930,10,
