Project/township/building,Tenure,Type,Median price,Median PSF,Transactions,Unnamed:6
"TAMAN DATUK TAMBY CHIK KARIMBatu Berendam, Melaka",Leasehold,Terrace House,"RM240,000",RM240,20,
"TAMAN DESA CEMPAKANilai, Negeri Sembilan",Freehold,Terrace House,"RM340,000",RM200,20,
"TTDI JAYAShah Alam, Selangor",Freehold,"Semi D, Terrace House","RM605,000",RM415,20,
"RPR BATU KAWAKuching, Sarawak","Leasehold, Freehold",Terrace House,"RM255,000",RM146,20,
"MUTIARA DAMANSARAMutiara Damansara, Selangor",Freehold,Terrace House,"RM1,525,000",RM849,20,
"TAMAN CHAI LENGPerai, Penang",Freehold,Terrace House,"RM485,000",RM293,20,
"TAMAN KOTA YONG PENGYong Peng, Johor",Freehold,Terrace House,"RM280,000",RM146,20,
"AMVERTON HILLS SUNGAI BULOHSungai Buloh, Selangor",Freehold,Semi D,"RM1,829,888",RM538,20,
"PERKAMPUNGAN SRI MAHKOTA AMANKuantan, Pahang",Freehold,Terrace House,"RM240,000",RM150,20,
"TAMAN INSANIAHKuala Ketil, Kedah",Freehold,Terrace House,"RM320,000",RM195,20,
"TAMAN GEMBIRAKlang, Selangor",Freehold,Terrace House,"RM550,000",RM345,20,
"TAMAN PUCHONG PERDANAPuchong, Selangor",Leasehold,Terrace House,"RM380,000",RM357,20,
"Metropolitan SquareDamansara Perdana, Selangor",Leasehold,Service Residence,"RM473,929",RM443,20,
"Arcoris ResidencesMont Kiara, Kuala Lumpur",Freehold,Service Residence,"RM1,011,955","RM1,043",20,
"Taman Lone Pine (Medium Low Cost)Ayer Itam, Penang",Freehold,Apartment,"RM204,000",RM387,20,
"Taman Bukit JambulBukit Jambul, Penang",Freehold,Flat,"RM250,000",RM302,20,
"Austin Regency (Pangsapuri Austin Perdana)Tebrau, Johor",Freehold,Apartment,"RM407,500",RM430,20,
"Flat Taman Alam MegahShah Alam, Selangor",Freehold,Flat,"RM152,500",RM254,20,
"The SeedSkudai, Johor",Freehold,Apartment,"RM650,000",RM480,20,
"Royal Domain Sri Putramas 2Jalan Kuching, Kuala Lumpur",Freehold,Condominium,"RM565,000",RM460,20,
"Desa Pinang 2Jelutong, Penang",Leasehold,Flat,"RM245,000",RM417,20,
"Bayu Puteri 3Johor Bahru, Johor",Leasehold,Apartment,"RM350,000",RM353,20,
"Taman Desa Relau 2Relau, Penang",Freehold,Apartment,"RM282,500",RM375,20,
"Bayu VillaKlang, Selangor",Freehold,Apartment,"RM320,000",RM314,20,
"Seri Semarak (Asia Heights)Ayer Itam, Penang",Freehold,Apartment,"RM371,500",RM473,20,
"Pangsapuri Sri KemuningShah Alam, Selangor",Freehold,Apartment,"RM251,500",RM333,20,
"The Grand Subang Jaya SS13Subang Jaya, Selangor",Freehold,Service Residence,"RM460,000",RM868,20,
"The Platino Serviced ApartmentTampoi, Johor",Freehold,Service Residence,"RM570,400",RM639,20,
"Taman Pandan PerdanaAmpang, Selangor",Leasehold,Flat,"RM138,000",RM206,20,
"Jazz Suites @ VivacityKuching, Sarawak",Leasehold,Condominium,"RM620,000",RM627,20,
"Selat Horizon CondominiumKlebang, Melaka",Freehold,Condominium,"RM222,500",RM227,20,
"Flat Taman MelatiSetapak, Kuala Lumpur",Freehold,Flat,"RM222,500",RM370,20,
"Permas Ville ApartmentPermas Jaya, Johor",Freehold,Apartment,"RM366,500",RM333,20,
"Taman Pandan IndahAmpang, Selangor",Leasehold,Flat,"RM151,000",RM251,20,
"Telipok SquareTuaran, Sabah",Leasehold,Flat,"RM130,000",RM206,20,
"TAMAN TUNKU MAHERANJitra, Kedah",Freehold,Terrace House,"RM227,000",RM180,19,
"TAMAN NILAM SARISeremban, Negeri Sembilan",Leasehold,Terrace House,"RM399,800",RM308,19,
"TAMAN MOSEY HILLIpoh, Perak",Leasehold,Terrace House,"RM399,880",RM236,19,
"PANORAMA LAPANGAN MUTIARAIpoh, Perak",Leasehold,Terrace House,"RM383,000",RM270,19,
"TAMAN DESA INTANKapar, Selangor",Leasehold,Terrace House,"RM358,000",RM270,19,
"TAMAN DAHLIATampoi, Johor",Leasehold,Terrace House,"RM280,000",RM269,19,
"BANGSAR BARUBangsar, Kuala Lumpur",Freehold,Terrace House,"RM1,600,000",RM854,19,
"TAMAN BUKIT FLORABatu Pahat, Johor",Freehold,Terrace House,"RM190,000",RM223,19,
"TAMAN DELIMA IIKluang, Johor",Freehold,"Terrace House, Semi D","RM357,000",RM205,19,
"PERUMAHAN SEDC (LOT 144)Kemaman, Terengganu",Leasehold,Terrace House,"RM185,000",RM105,19,
"BANDAR BARU KANGKAR PULAISkudai, Johor",Leasehold,Cluster House,"RM478,000",RM231,19,
"TAMAN SIMPANG BERSATUTaiping, Perak",Freehold,Terrace House,"RM298,800",RM209,19,
"TAMAN MENGKIBOLKluang, Johor",Freehold,Terrace House,"RM280,000",RM196,19,
"TAMAN IMPIAN JAYASenai, Johor",Leasehold,Terrace House,"RM398,000",RM211,19,
"TAMAN CLONLEE IITampin, Negeri Sembilan",Freehold,"Bungalow, Terrace House","RM390,000",RM188,19,
"BANDAR BARU PUTRAIpoh, Perak","Leasehold, Freehold",Terrace House,"RM240,000",RM164,19,
"TAMAN DESA MANJUNG RAYALumut, Perak",Leasehold,"Semi D, Bungalow","RM480,000",RM178,19,
"BANDAR BARU SELAYANGSelayang, Selangor",Leasehold,Terrace House,"RM680,000",RM415,19,
"TAMAN GEMBIRATampoi, Johor",Freehold,Terrace House,"RM400,000",RM247,19,
"TAMAN BANANGBatu Pahat, Johor",Freehold,Terrace House,"RM288,000",RM153,19,
"TAMAN SRI CENDEKIA (TAMAN CONNAUGHT)Cheras, Kuala Lumpur",Leasehold,Terrace House,"RM675,000",RM390,19,
"TAMAN PERDA INDAHTasek Gelugor, Penang",Freehold,Terrace House,"RM80,000",RM73,19,
"TAMAN KEMPAS UTAMASkudai, Johor",Freehold,"Terrace House, Semi D","RM820,000",RM418,19,
"PERUMAHAN KEMPADANG VILLAGEKuantan, Pahang",Leasehold,Terrace House,"RM244,000",RM187,19,
"TAMAN SAUJANA INDAHBukit Katil, Melaka",Freehold,"Terrace House, Semi D","RM300,000",RM168,19,
"SEKSYEN 13 SHAH ALAMShah Alam, Selangor",Leasehold,"Terrace House, Semi D","RM1,125,000",RM434,19,
"TAMU HILL PARKBatang Kali, Selangor",Freehold,Terrace House,"RM380,000",RM227,19,
"P/L 104445 & P/L 104476(LOT 2507)Kuantan, Pahang",Freehold,Terrace House,"RM271,790",RM174,19,
"SEKSYEN 3 BANDAR BARU BANGIBangi, Selangor",Leasehold,"Terrace House, Semi D","RM530,000",RM360,19,
"TAMAN AUSTIN HEIGHTSTebrau, Johor",Freehold,"Cluster House, Semi D","RM1,138,000",RM412,19,
"TAMAN BUKIT KATIL INDAHBukit Katil, Melaka",Freehold,"Terrace House, Semi D","RM280,000",RM182,19,
"TAMAN BUKIT TERATAIAmpang, Selangor",Leasehold,"Town House, Terrace House","RM430,000",RM415,19,
"COUNTRY VILLASBemban, Melaka",Leasehold,Terrace House,"RM530,000",RM344,19,
"I-Park ApartmentSungai Ara, Penang",Freehold,Flat,"RM225,000",RM337,19,
"Tanjong Puteri ApartmentPasir Gudang, Johor",Freehold,Apartment,"RM165,000",RM149,19,
"Kuchai AvenueKuchai Lama, Kuala Lumpur",Freehold,Service Residence,"RM580,000",RM626,19,
"Taman Setia JayaAlor Setar, Kedah",Freehold,Flat,"RM50,000",RM91,19,
"JasaSkudai, Johor",Leasehold,Flat,"RM130,000",RM212,19,
"Taman Tun TejaRawang, Selangor",Leasehold,Flat,"RM220,000",RM273,19,
"Rasah Jaya FlatRasah, Negeri Sembilan",Freehold,Flat,"RM70,000",RM112,19,
"Ixora ApartmentBukit Baru, Melaka",Freehold,Apartment,"RM310,000",RM248,19,
"Villa FloraTaman Tun Dr Ismail, Kuala Lumpur",Freehold,Condominium,"RM900,000",RM574,19,
"Changkat ViewDutamas, Kuala Lumpur",Freehold,Condominium,"RM495,000",RM451,19,
"Twin Galaxy (Dwi Galaksi)Johor Bahru, Johor",Freehold,Service Residence,"RM580,000",RM620,19,
"TAMAN LAGUNAPerling, Johor",Freehold,Terrace House,"RM915,000",RM348,18,
"RESIDENSI VILLA MUTIARASungai Bakap, Penang",Freehold,"Terrace House, Semi D","RM560,000",RM347,18,
"TAMAN SERAI WANGI FASA IIPadang Serai, Kedah",Freehold,"Terrace House, Bungalow","RM292,500",RM179,18,
"NUSARI AMAN 1Bandar Sri Sendayan, Negeri Sembilan",Freehold,Terrace House,"RM393,500",RM214,18,
"TAMAN SEREMBAN 3Rasah, Negeri Sembilan",Freehold,Terrace House,"RM330,000",RM223,18,
"RESORT RESIDENCE 2Bandar Sri Sendayan, Negeri Sembilan",Freehold,Terrace House,"RM768,888",RM467,18,
"TAMAN KINDING AKASIAIpoh, Perak",Leasehold,Terrace House,"RM260,000",RM186,18,
"BAYU SUTERA - PRECINT 1BJimah, Negeri Sembilan",Freehold,Terrace House,"RM568,944",RM407,18,
"PINGGIRAN BAYU (MANTAU)Rasah, Negeri Sembilan",Freehold,Terrace House,"RM470,000",RM336,18,
"TAMAN MANTAU INDAHSeremban 2, Negeri Sembilan","Leasehold, Freehold",Terrace House,"RM255,000",RM191,18,
"TAMAN DESA BUKIT NILAMKapar, Selangor",Freehold,Terrace House,"RM498,000",RM387,18,
"TAMAN DESA BUKIT PERMATAKapar, Selangor",Freehold,Terrace House,"RM406,500",RM233,18,
"PEKAN BARUParit Buntar, Perak","Leasehold, Freehold","Terrace House, Semi D, Bungalow","RM245,000",RM193,18,
"EVERGREEN GARDEN RESIDENCECyberjaya, Selangor",Freehold,"Bungalow, Semi D","RM1,496,000",RM450,18,
"TAMAN SENAWANG PERDANARantau, Negeri Sembilan",Freehold,Bungalow,"RM695,000",RM166,18,
"TAMAN NILAM BAIDURIKulim, Kedah",Freehold,Terrace House,"RM320,000",RM213,18,
"PUNCAK ISKANDARSeri Iskandar, Perak",Leasehold,Terrace House,"RM344,040",RM142,18,
"TAMAN PSJSungai Karang, Pahang",Freehold,Terrace House,"RM272,500",RM200,18,
"TAMAN PUCHONG PRIMAPuchong, Selangor",Freehold,Terrace House,"RM638,000",RM489,18,
"TAMAN KOTA LAKSAMANA SEKSYEN 1Melaka City, Melaka",Leasehold,"Town House, Terrace House","RM345,000",RM238,18,
"TAMAN KAMPAR PUTRAKampar, Perak",Leasehold,Terrace House,"RM215,000",RM154,18,
"TAMAN SERI MANGGA SEKSYEN 1Balai Panjang, Melaka","Leasehold, Freehold",Terrace House,"RM337,200",RM223,18,
"PULAU SERAI / G BINJAI / DARAT PELANDANGDungun, Terengganu",Freehold,"Semi D, Bungalow","RM337,500",RM102,18,
"TROPICANA DANGA COVEMasai, Johor",Freehold,Terrace House,"RM696,500",RM479,18,
"TAMAN NESASkudai, Johor",Leasehold,Terrace House,"RM390,000",RM253,18,
"TAMAN DELIMASungai Petani, Kedah",Freehold,Terrace House,"RM239,000",RM140,18,
"TAMAN NURIDurian Tunggal, Melaka",Freehold,"Cluster House, Semi D","RM649,000",RM221,18,
"TAMAN SUNGAI BESI INDAHSeri Kembangan, Selangor","Freehold, Leasehold","Bungalow, Terrace House, Town House","RM627,500",RM343,18,
"TAMAN INTAN PERDANATelok Kemang, Negeri Sembilan","Freehold, Leasehold",Terrace House,"RM200,000",RM157,18,
"BUKIT BANDARAYABangsar, Kuala Lumpur",Freehold,"Terrace House, Bungalow","RM3,825,000",RM765,18,
"TAMAN SEMENYIH MEWAHSemenyih, Selangor",Freehold,"Terrace House, Semi D","RM576,000",RM352,18,
"TAMAN KASIH PUTERARompin, Negeri Sembilan",Freehold,"Terrace House, Semi D","RM80,000",RM67,18,
"TAMAN KLEBANG JAYAChemor, Perak",Leasehold,Terrace House,"RM192,500",RM151,18,
"BANDAR PUTERI JAYA SEKSYEN 3Sungai Petani, Kedah",Freehold,"Terrace House, Semi D","RM325,000",RM117,18,
"TAMAN KASTURISitiawan, Perak",Freehold,Terrace House,"RM499,300",RM326,18,
"ECO GRANDEURIjok, Selangor",Leasehold,"Terrace House, Semi D","RM785,000",RM438,18,
"KOTA PUTERI BANDAR BARU BATU ARANGBatu Arang, Selangor",Leasehold,Terrace House,"RM407,500",RM278,18,
"TAMAN JUJURSikamat, Negeri Sembilan",Freehold,Cluster House,"RM118,500",RM127,18,
"TAMAN TASIK PRIMAPuchong, Selangor",Leasehold,Terrace House,"RM680,000",RM418,18,
"TAMAN TANJUNG MINYAK JAYATanjong Minyak, Melaka",Freehold,"Terrace House, Semi D","RM253,000",RM212,18,
"BANDAR TASIK IDAMANBatu Gajah, Perak",Leasehold,Terrace House,"RM378,000",RM259,18,
"TAMAN INDAH (SUNGAI UDANG)Masjid Tanah, Melaka",Leasehold,Terrace House,"RM270,000",RM189,18,
"TAMAN MUHIBAHKulai, Johor",Freehold,Terrace House,"RM305,000",RM330,18,
"Koi KinraraPuchong, Selangor",Freehold,Service Residence,"RM480,000",RM405,18,
"Tropicana Bay ResidencesBayan Lepas, Penang",Freehold,Condominium,"RM650,000",RM627,18,
"M Condominium @ LarkinJohor Bahru, Johor",Leasehold,Condominium,"RM465,000",RM425,18,
"Seri JatiSetia Alam, Selangor",Freehold,Apartment,"RM308,000",RM377,18,
"Beverly Hills 2Kota Kinabalu, Sabah",Leasehold,Apartment,"RM285,000",RM344,18,
"Gat Lebuh MacallumGeorgetown, Penang",Leasehold,Flat,"RM172,500",RM330,18,
"Idaman SelasihBayan Lepas, Penang",Freehold,Flat,"RM275,000",RM406,18,
"Mutiara PerdanaBayan Lepas, Penang",Freehold,Apartment,"RM296,500",RM357,18,
"Damai ApartmentShah Alam, Selangor",Leasehold,Apartment,"RM313,000",RM366,18,
"Pelangi Damansara 1Bandar Utama, Selangor",Leasehold,Apartment,"RM385,000",RM419,18,
"D'CassiaSemenyih, Selangor",Freehold,Apartment,"RM291,000",RM338,18,
"PD Marina World ResortPort Dickson, Negeri Sembilan",Freehold,Condominium,"RM81,000",RM109,18,
"Sun Moon CityAyer Itam, Penang",Freehold,Flat,"RM155,000",RM239,18,
"Green AcreBandar Sungai Long, Selangor",Freehold,Condominium,"RM489,500",RM484,18,
"Desa Permai Indah FlatSungai Dua, Penang",Leasehold,Flat,"RM170,000",RM305,18,
"Seremban PutraSikamat, Negeri Sembilan",Freehold,Apartment,"RM180,000",RM220,18,
"Endah RiaSri Petaling, Kuala Lumpur",Leasehold,Condominium,"RM327,500",RM335,18,
"Perdana ExclusiveDamansara Perdana, Selangor",Leasehold,Condominium,"RM357,500",RM371,18,
"Taman Telipok Ria Fasa 1 & Fasa 2Tuaran, Sabah",Leasehold,Apartment,"RM162,500",RM267,18,
"TAMAN PELANGISemenyih, Selangor",Freehold,Terrace House,"RM410,000",RM300,17,
"TAMAN BERKELEYKapar, Selangor",Freehold,Terrace House,"RM480,000",RM300,17,
"SPRINGVILLE @VICTORIA COUNTRYSitiawan, Perak",Freehold,"Semi D, Terrace House","RM546,000",RM213,17,
"TAMAN LANG RESIDENCESIpoh, Perak",Freehold,Terrace House,"RM442,000",RM316,17,
"TAMAN BANDAR SENAWANGSenawang, Negeri Sembilan",Freehold,Terrace House,"RM440,000",RM242,17,
"TAMAN DAIMAN JAYAKota Tinggi, Johor",Freehold,"Terrace House, Cluster House","RM590,000",RM353,17,
"TAMAN CHERAS (YULEK HEIGHTS)Cheras, Kuala Lumpur",Freehold,Terrace House,"RM845,000",RM441,17,
"TAMAN SONG CHOONIpoh, Perak",Leasehold,Terrace House,"RM240,000",RM211,17,
"BANDAR BARU KAMPARKampar, Perak",Leasehold,Terrace House,"RM200,000",RM151,17,
"SP SAUJANASungai Petani, Kedah",Freehold,"Terrace House, Semi D","RM450,000",RM203,17,
"PRIMA BERUNTUNGSerendah, Selangor",Freehold,"Bungalow, Terrace House","RM520,000",RM105,17,
"TAMAN CRESCENTIABatu Kawan, Penang",Leasehold,Terrace House,"RM340,000",RM269,17,
"TAMAN SRI GEDONGSungai Petani, Kedah",Freehold,Terrace House,"RM195,000",RM142,17,
"TAMAN ANJUNG GAPAMBemban, Melaka",Leasehold,Bungalow,"RM640,000",RM133,17,
"TAMAN IPOH TIMURIpoh, Perak","Freehold, Leasehold",Terrace House,"RM310,000",RM207,17,
"TAMAN MANJUNG POINT SEKSYEN 2(PL 12194)Lumut, Perak",Freehold,Terrace House,"RM300,000",RM230,17,
"TAMAN DESA JENJAROMJenjarom, Selangor","Freehold, Leasehold",Terrace House,"RM640,000",RM286,17,
"TAMAN DELIMABanting, Selangor",Freehold,"Terrace House, Bungalow","RM480,000",RM267,17,
"KAMPUNG BARU SERI KEMBANGANSeri Kembangan, Selangor",Leasehold,Bungalow,"RM450,000",RM114,17,
"TAMAN DUSUN SETIASeremban, Negeri Sembilan",Freehold,Terrace House,"RM210,000",RM238,17,
"BUKIT ANGGERIKCheras, Kuala Lumpur",Leasehold,Terrace House,"RM430,000",RM352,17,
"TAMAN SEJAHTERA (SPT)Bukit Mertajam, Penang",Freehold,Terrace House,"RM320,000",RM273,17,
"TAMAN BANDAR BARU LAHATLahat, Perak",Leasehold,Terrace House,"RM255,000",RM235,17,
"ARA DAMANSARAAra Damansara, Selangor",Freehold,Terrace House,"RM1,460,000",RM704,17,
"TAMAN MELAKA BARUBatu Berendam, Melaka",Leasehold,Terrace House,"RM205,000",RM194,17,
"MELIA RESIDENCESGelang Patah, Johor",Freehold,Terrace House,"RM700,000",RM432,17,
"TAMAN NUSA INTANAmpangan, Negeri Sembilan",Freehold,Terrace House,"RM370,000",RM227,17,
"SERENE HEIGHTSSemenyih, Selangor",Freehold,Terrace House,"RM700,000",RM423,17,
"TAMAN BUKIT CHENGCheng, Melaka",Freehold,Terrace House,"RM400,000",RM253,17,
"TAMAN KINTA PERMAIBatu Gajah, Perak",Leasehold,"Bungalow, Terrace House","RM300,000",RM146,17,
"TAMAN ANGGUNRawang, Selangor",Freehold,"Semi D, Terrace House","RM875,000",RM366,17,
"SUNWAY SPK DAMANSARASunway SPK, Kuala Lumpur",Freehold,Terrace House,"RM2,138,000","RM1,032",17,
"TAMAN PERTAMA INDAH ~ JALAN BAKRIBakri, Johor",Freehold,"Terrace House, Semi D","RM808,000",RM326,17,
"SEKSYEN 29 SHAH ALAMShah Alam, Selangor","Leasehold, Freehold","Bungalow, Semi D, Terrace House","RM530,000",RM296,17,
"SRI INDERAPURAKuantan, Pahang",Leasehold,"Semi D, Terrace House","RM175,000",RM137,17,
"TAMAN MAJUBatu Pahat, Johor",Freehold,Terrace House,"RM340,000",RM236,17,
"BANDAR HILLPARKBandar Puncak Alam, Selangor",Leasehold,Terrace House,"RM555,000",RM312,17,
"TAMAN SRI SERDANGSeri Kembangan, Selangor",Leasehold,"Terrace House, Town House","RM388,000",RM286,17,
"TAMAN SAMUDERALumut, Perak",Leasehold,Terrace House,"RM210,000",RM191,17,
"TAMAN MEWAHKamunting, Perak",Leasehold,Terrace House,"RM195,000",RM143,17,
"KAMPUNG BARU MENGLEMBUMenglembu, Perak",Leasehold,Bungalow,"RM180,000",RM46,17,
"TAMAN BUKIT RAWANG JAYARawang, Selangor",Freehold,Terrace House,"RM340,000",RM258,17,
"TAMAN ANGGERIKTampoi, Johor",Freehold,Terrace House,"RM345,000",RM317,17,
"TAMAN LANGAT UTAMA 3Tanjong Duabelas, Selangor",Leasehold,Terrace House,"RM390,000",RM277,17,
"TAMAN KAJANG UTAMAKajang, Selangor",Freehold,"Terrace House, Town House","RM390,000",RM300,17,
"TAMAN DAMAI FASA 1Padang Serai, Kedah",Freehold,Terrace House,"RM300,000",RM214,17,
"PELABUHAN KLANGPort Klang, Selangor",Freehold,Terrace House,"RM450,000",RM204,17,
"Taman Tasek RethinaTasek Gelugor, Penang",Freehold,Flat,"RM55,000",RM102,17,
"D'Rich Executive SuitesIskandar Puteri (Nusajaya), Johor",Freehold,Apartment,"RM440,000",RM418,17,
"Fortune PerdanaKepong, Kuala Lumpur",Leasehold,Service Residence,"RM562,000",RM485,17,
"Putri Ria ApartmentMasai, Johor",Freehold,Apartment,"RM250,000",RM261,17,
"One ImperialSungai Ara, Penang",Freehold,Condominium,"RM560,000",RM464,17,
"Bandar Tasik Selatan (Low Cost)Bandar Tasik Selatan, Kuala Lumpur",Leasehold,Flat,"RM200,000",RM304,17,
"Hillview LoftBatu Pahat, Johor",Freehold,Condominium,"RM342,000",RM303,17,
"Prai InaiPerai, Penang",Freehold,Apartment,"RM273,000",RM302,17,
"Desa Sri PuteriDesa Petaling, Kuala Lumpur",Leasehold,Flat,"RM135,000",RM224,17,
"Pan VistaPermas Jaya, Johor",Freehold,Apartment,"RM330,000",RM316,17,
"Centrio AvenueGelugor, Penang",Freehold,Flat,"RM295,000",RM428,17,
"Sri Palma VillaMantin, Negeri Sembilan",Freehold,"Service Residence, Apartment","RM95,000",RM93,17,
"10 Mont Kiara @ MK10Mont Kiara, Kuala Lumpur",Freehold,Condominium,"RM3,200,000",RM881,17,
"Seri Kasturi ApartmentsSetia Alam, Selangor",Freehold,Apartment,"RM378,000",RM395,17,
"Iconic SkiesSungai Ara, Penang",Freehold,Condominium,"RM788,000",RM616,17,
"Flat PKNS Section 7Shah Alam, Selangor",Leasehold,Flat,"RM217,000",RM300,17,
"Laguna BiruRawang, Selangor",Leasehold,Apartment,"RM220,000",RM259,17,
"Pelangi HeightsKlang, Selangor",Freehold,Apartment,"RM380,000",RM329,17,
"Tanjung CourtAyer Itam, Penang",Leasehold,Apartment,"RM260,000",RM335,17,
"TAMAN PD UTAMAPort Dickson, Negeri Sembilan",Freehold,Terrace House,"RM180,000",RM129,16,
"TAMAN BUKIT INDAHUlu Klang, Selangor",Leasehold,"Terrace House, Semi D","RM725,000",RM500,16,
"SS23 TAMAN SEAPetaling Jaya, Selangor",Freehold,Terrace House,"RM1,395,000",RM776,16,
"SS15Subang Jaya, Selangor",Freehold,Terrace House,"RM780,000",RM444,16,
"TAMAN BANJAR INDAHTeluk Intan, Perak",Freehold,Terrace House,"RM299,000",RM203,16,
"TAMAN TANJUNG UTARAIpoh, Perak",Freehold,"Cluster House, Terrace House","RM383,000",RM126,16,
"BANDAR BESTARI/CANARY GARDENKlang, Selangor",Freehold,Semi D,"RM1,407,500",RM465,16,
"RESIDENSI EMERALD DAMAI (EMERALD HILLS)Cheras, Kuala Lumpur",Freehold,Terrace House,"RM1,525,000",RM914,16,
"TAMAN SRI MUTIARABandar Baharu, Kedah",Freehold,Terrace House,"RM360,667",RM155,16,
"LEXVIEWIpoh, Perak",Leasehold,Terrace House,"RM438,880",RM285,16,
"TAMAN KAMPAR BESTARIKampar, Perak",Leasehold,Semi D,"RM343,800",RM106,16,
"SEREMBAN FOREST HEIGHTS (HERMOSO)Ampangan, Negeri Sembilan",Freehold,Terrace House,"RM250,000",RM192,16,
"LEMBAH BERINGINKuala Kubu Baru, Selangor",Freehold,Terrace House,"RM120,000",RM75,16,
"TAMAN SRI NIBONGBayan Lepas, Penang",Freehold,Terrace House,"RM1,010,000",RM698,16,
"DESA MAYANG SARINilai, Negeri Sembilan",Freehold,Terrace House,"RM629,000",RM460,16,
"TAMAN CEMPAKA (TELUI KIRI)Teloi Kiri, Kedah",Freehold,Terrace House,"RM169,000",RM117,16,
"SETIA INDAH 11Setia Alam, Selangor",Freehold,Terrace House,"RM662,500",RM513,16,
"PERKAMPUNGAN CENDERAWASIHKuantan, Pahang",Leasehold,Terrace House,"RM167,500",RM187,16,
"TAMAN KLEDANG, SUNGAI SIPUTSungai Siput, Perak",Leasehold,Terrace House,"RM172,500",RM120,16,
"TAMAN RIA FASA 1Padang Serai, Kedah",Freehold,Terrace House,"RM252,000",RM178,16,
"TAMAN PRIMA SAUJANAKajang, Selangor",Freehold,"Semi D, Terrace House","RM552,500",RM391,16,
"TAMAN PANGKOR MUTIARAPangkor, Perak",Freehold,Terrace House,"RM618,800",RM348,16,
"SETIA PULAU MUTIARABayan Lepas, Penang",Freehold,Terrace House,"RM1,365,000",RM702,16,
"TAMAN PINANG SEBERANGKamunting, Perak",Freehold,Terrace House,"RM215,500",RM180,16,
"TAMAN BUKIT NURI INDAHRasah, Negeri Sembilan",Freehold,Terrace House,"RM367,500",RM219,16,
"TAMAN INTANKluang, Johor",Freehold,Terrace House,"RM255,000",RM180,16,
"TAMAN JASMINKajang, Selangor",Freehold,Terrace House,"RM462,500",RM313,16,
"TAMAN WIRA (RPA MERGONG)Alor Setar, Kedah",Freehold,Terrace House,"RM39,600",RM38,16,
"TAMAN BUKIT JURUJuru, Penang",Freehold,"Terrace House, Bungalow","RM805,000",RM261,16,
"TAMAN KULIM TECHNOCITY FASA 3Kulim, Kedah",Freehold,Terrace House,"RM375,000",RM299,16,
"TAMAN SERI BAYUSungai Petani, Kedah",Freehold,Terrace House,"RM177,500",RM149,16,
"TAMAN DESAWANKlang, Selangor",Freehold,Terrace House,"RM465,000",RM359,16,
"TAMAN BUKIT BELIMBINGBalakong, Selangor",Freehold,Terrace House,"RM472,500",RM454,16,
"RESIDENSI PR1MA SERI MAHKOTAKulim, Kedah",Freehold,Terrace House,"RM221,000",RM136,16,
"TAMAN EHSAN JAYAUlu Tiram, Johor",Leasehold,Terrace House,"RM650,000",RM442,16,
"TAMAN BERTAM SETIATanjong Minyak, Melaka",Freehold,"Terrace House, Semi D","RM447,500",RM229,16,
"TAMAN SERI AMANMasjid Tanah, Melaka",Freehold,Terrace House,"RM180,000",RM113,16,
"TAMAN AMANKulai, Johor",Freehold,Terrace House,"RM300,000",RM241,16,
"TAMAN BUKIT RANGIN PERDANA 1 & 2Kuantan, Pahang",Leasehold,Terrace House,"RM220,000",RM167,16,
"TAMAN TELOKTelok Panglima Garang, Selangor",Freehold,Terrace House,"RM360,000",RM213,16,
"TAMAN NUSA PERINTIS IIIskandar Puteri (Nusajaya), Johor",Freehold,Terrace House,"RM480,000",RM388,16,
"MEDAN LAHAT BARULahat, Perak",Leasehold,Terrace House,"RM291,800",RM197,16,
"TABUAN HEIGHTSKuching, Sarawak","Leasehold, Freehold","Semi D, Terrace House","RM755,000",RM321,16,
"USJ 12Subang Jaya, Selangor",Freehold,Terrace House,"RM654,000",RM521,16,
"BANDAR MACANG BUBOKBukit Mertajam, Penang",Freehold,Terrace House,"RM392,000",RM280,16,
"TAMAN SAUJANAKluang, Johor",Freehold,Terrace House,"RM341,500",RM156,16,
"Symphony Heights (Simfoni Heights)Batu Caves, Selangor",Leasehold,Condominium,"RM350,000",RM346,16,
"Mutiara HeightsJelutong, Penang",Leasehold,Apartment,"RM337,500",RM435,16,
"Enggang ApartmentBandar Kinrara, Selangor",Freehold,Apartment,"RM142,500",RM210,16,
"Atlantis Residences (Pangsapuri Atlantis Kota Syahbandar)Melaka City, Melaka",Leasehold,Service Residence,"RM434,250",RM473,16,
"Pangsapuri Sri MerantiBandar Sri Damansara, Selangor",Freehold,Flat,"RM165,000",RM254,16,
"Mutiara MagnaKepong, Kuala Lumpur",Leasehold,Flat,"RM198,500",RM279,16,
"Rampai CourtWangsa Maju, Kuala Lumpur",Freehold,Apartment,"RM325,000",RM549,16,
"Skysuites @ Meldrum HillsJohor Bahru, Johor",Freehold,Service Residence,"RM562,500",RM659,16,
"Prima Bayu ApartmentKlang, Selangor",Freehold,Apartment,"RM325,000",RM286,16,
"Residensi Warnasari 3Bandar Puncak Alam, Selangor",Leasehold,Apartment,"RM192,500",RM265,16,
"Taman Tun Hussein OnnPerai, Penang",Freehold,Flat,"RM86,000",RM146,16,
"The WaterEdge (Pinggiran Air)Permas Jaya, Johor",Freehold,"Apartment, Condominium","RM591,000",RM452,16,
"28 Mont Kiara @ MK28Mont Kiara, Kuala Lumpur",Freehold,Condominium,"RM1,855,000",RM712,16,
"Lido Four Seasons ResidencePenampang, Sabah",Freehold,Condominium,"RM500,000",RM500,16,
"Desa ImpianaPuchong, Selangor",Freehold,Condominium,"RM390,000",RM374,16,
"Endah VillaSri Petaling, Kuala Lumpur",Leasehold,Condominium,"RM340,000",RM301,16,
"Platinum Lake PV 21Setapak, Kuala Lumpur",Leasehold,Service Residence,"RM420,000",RM697,16,
"Sea View TowerButterworth, Penang",Freehold,Condominium,"RM375,000",RM345,16,
"Pangsapuri Perdana VillaKlang, Selangor",Freehold,Apartment,"RM270,000",RM279,16,
"Vista MagnaKepong, Kuala Lumpur",Leasehold,Apartment,"RM295,000",RM332,16,
"Taman Sri Batu CavesBatu Caves, Selangor",Freehold,Flat,"RM133,500",RM203,16,
"All Seasons ParkAyer Itam, Penang",Freehold,Condominium,"RM532,500",RM523,16,
"Bandar Sultan SuleimanPort Klang, Selangor",Leasehold,Flat,"RM127,500",RM167,16,
"Taman Cheng RiaCheng, Melaka",Leasehold,Flat,"RM147,500",RM171,16,
"Taman SogaBatu Pahat, Johor",Freehold,Flat,"RM81,500",RM118,16,
"Sri Anggerik 2Puchong, Selangor",Freehold,Apartment,"RM320,500",RM397,16,
"Taman Machang BubokBukit Mertajam, Penang",Freehold,Flat,"RM77,500",RM130,16,
"Seri Intan ApartmentSetia Alam, Selangor",Freehold,Apartment,"RM298,500",RM360,16,
"The Zest @ Kinrara 9Bandar Kinrara, Selangor",Freehold,Condominium,"RM517,500",RM448,16,
"Kenanga PointKL City, Kuala Lumpur",Freehold,Condominium,"RM425,000",RM456,16,
"Seri Puteri HillsPuchong, Selangor",Freehold,Condominium,"RM1,113,500",RM680,16,
"Rhythm AvenueSubang Jaya, Selangor",Freehold,Service Residence,"RM270,000",RM332,16,
"One Central ParkDesa ParkCity, Kuala Lumpur",Freehold,Condominium,"RM1,902,500","RM1,182",16,
"TAMAN BUKIT SERDANG SEKSYEN 5Seri Kembangan, Selangor",Freehold,Terrace House,"RM630,000",RM434,15,
"TAMAN BRINGINJinjang, Kuala Lumpur","Leasehold, Freehold",Cluster House,"RM330,000",RM504,15,
"BANDAR AMANJAYA (ZON SEROJA)Sungai Petani, Kedah",Freehold,Terrace House,"RM210,000",RM161,15,
"TAMAN BUKIT SUBANGShah Alam, Selangor",Freehold,Terrace House,"RM620,000",RM415,15,
"TAMAN MERU TROPIKAIpoh, Perak",Freehold,Terrace House,"RM339,000",RM206,15,
"TAMAN DARULAMAN LAGENDASungai Petani, Kedah",Freehold,Terrace House,"RM199,900",RM143,15,
"PL 155856, TAMAN KOBAT RESIDENSI 2Kuantan, Pahang",Freehold,Terrace House,"RM342,000",RM190,15,
"BANDAR BARU SUNGAI BULOHSungai Buloh, Selangor",Leasehold,Terrace House,"RM420,000",RM286,15,
"TAMAN SATRIA JAYAKuching, Sarawak",Leasehold,Terrace House,"RM500,000",RM300,15,
"TAMAN EHSAN JAYAJohor Bahru, Johor",Leasehold,Terrace House,"RM688,000",RM443,15,
